"created_at","screen_name","text","name","location","is_retweet","date"
2020-05-14 18:44:56,"BarackObama","Vote.","Barack Obama","Washington, DC",FALSE,2020-05-14
2020-05-14 15:30:44,"BarackObama","Michelle and I want to do our part to give all you parents a break today, so we’re reading “The Word Collector” for @chipublib. It’s a fun book that vividly illustrates the transformative power of words––and we hope you enjoy it as much as we did. https://t.co/ADYbL6Dzg4","Barack Obama","Washington, DC",FALSE,2020-05-14
2020-05-13 23:05:11,"BarackObama","Despite all the time that’s been lost, we can still make real progress against the virus, protect people from the economic fallout, and more safely approach something closer to normal if we start making better policy decisions now.
https://t.co/pfokyI8GiB","Barack Obama","Washington, DC",FALSE,2020-05-13
2020-05-11 21:06:14,"BarackObama","Change comes when all of us step up and play our part in this democracy. By encouraging our young people, like these students from @ChiPubSchools, to start engaging in our civic life today, we’re already creating something better for tomorrow. https://t.co/9ScwPruoyA","Barack Obama","Washington, DC",FALSE,2020-05-11
2020-05-10 15:03:15,"BarackObama","Even if you can’t give the moms in your life a hug today, I hope you can give them an extra thank you today. Thank you and Happy Mother’s Day to the woman who makes it all possible. Love you, @michelleobama. https://t.co/E9ebxaSBpy","Barack Obama","Washington, DC",FALSE,2020-05-10
2020-05-06 14:10:45,"BarackObama","There’s no limit to the devotion I’ve seen in teachers like these @ChiPubSchools educators. Their dedication shapes the best parts of who we become. I couldn’t be more thankful for their work, especially as they shift lessons online to keep students on track during this crisis. https://t.co/xYECcrAxdE","Barack Obama","Washington, DC",FALSE,2020-05-06
2020-05-05 15:05:41,"BarackObama","I’ve always loved joining commencements––the culmination of years of hard work and sacrifice. Even if we can’t get together in person this year, Michelle and I are excited to celebrate the nationwide Class of 2020 and recognize this milestone with you and your loved ones. https://t.co/ngR2ykx3A2","Barack Obama","Washington, DC",FALSE,2020-05-05
2020-05-01 18:25:11,"BarackObama","The folks of the Chicago @fooddepository—and food banks in communities like yours—are working overtime to feed the vulnerable and families who’ve fallen on hard times. But even as demand has spiked, donations have slowed. Their incredible efforts are worth supporting if you can. https://t.co/kSdijlyHLH","Barack Obama","Washington, DC",FALSE,2020-05-01
2020-04-27 17:22:11,"BarackObama","The pandemic has magnified the financial insecurity of too many American families, the deep and real racial disparities in our society – and the imbalanced burdens on working moms. We have to create something better for America on the other side of this. https://t.co/eyy3dC22Ze","Barack Obama","Washington, DC",FALSE,2020-04-27
2020-04-25 20:49:19,"BarackObama","In moments of crisis, we look out for one other. And we need leaders with empathy who will bring people together rather than drive them apart. @JoeBiden has the character and experience to guide us through one of our darkest times and heal us through a long recovery. https://t.co/JkaBWYejKh","Barack Obama","Washington, DC",FALSE,2020-04-25
2020-04-25 00:00:58,"BarackObama","This pandemic has painfully brought to the surface many of the reasons I launched @MBK_Alliance—structural racism robs too many of our kids of their futures. The leaders on today's call aren't just tackling this crisis; they’re helping us build a more equitable future for all. https://t.co/9dsedZYt0E","Barack Obama","Washington, DC",FALSE,2020-04-25
2020-04-24 20:53:55,"BarackObama","If we want life to approach anything like normal anytime soon, we need a comprehensive testing program. It’s not going to be cheap, but it will ultimately pay off many times over in saved lives, saved businesses, and saved jobs. https://t.co/pnN9KVcvQR","Barack Obama","Washington, DC",FALSE,2020-04-24
2020-04-22 19:40:36,"BarackObama","While we continue to wait for a coherent national plan to navigate this pandemic, states like Massachusetts are beginning to adopt their own public health plans to combat this virus––before it's too late. https://t.co/Eb2Hz8H8vU","Barack Obama","Washington, DC",FALSE,2020-04-22
2020-04-22 15:32:30,"BarackObama","We've all had to adapt to cope with a pandemic. Climate change will force far harsher changes on our kids. All of us should follow the young people who've led the efforts to protect our planet for generations, and demand more of our leaders at every level. https://t.co/uNueQl5bNX","Barack Obama","Washington, DC",FALSE,2020-04-22
2020-04-20 17:01:39,"BarackObama","Parents, you deserve a break – Michelle’s got storytime handled every Monday. She’s one of the best, I promise. (And I confess it makes me a little nostalgic.) https://t.co/Pmz8kRNMBC","Barack Obama","Washington, DC",FALSE,2020-04-20
2020-04-17 19:52:14,"BarackObama","Proud of the leaders in my hometown of Chicago who are showing us what it means to be there for each other––as neighbors and as citizens. https://t.co/DjnC1F9ph7","Barack Obama","Washington, DC",FALSE,2020-04-17
2020-04-17 14:45:45,"BarackObama","When I think of people I’ve counted on over the years, Sarah Hurwitz comes to mind. She's the talented author of @HereAllAlong, and a longtime member of my team. Here she shares her experience with faith, traditions, and staying connected during this time. https://t.co/pftk4JkhKQ","Barack Obama","Washington, DC",FALSE,2020-04-17
2020-04-15 16:43:48,"BarackObama","Democracy depends on an informed citizenry and social cohesion. Here’s a look at how misinformation can spread through social media, and why it can hurt our ability to respond to crises. https://t.co/qnLcR3mh8A","Barack Obama","Washington, DC",FALSE,2020-04-15
2020-04-14 16:02:07,"BarackObama","For all of us who love this country and are willing to do our part to make sure it lives up to its highest ideals – now’s the time to fight for what we believe in. Join us at https://t.co/Kboaxi3MVL. And I’ll see you on the campaign trail as soon as I can.","Barack Obama","Washington, DC",FALSE,2020-04-14
2020-04-14 15:47:23,"BarackObama","I’m proud to endorse my friend @JoeBiden for President of the United States. Let's go: https://t.co/maHVGRozkX","Barack Obama","Washington, DC",FALSE,2020-04-14
2020-04-13 18:01:58,"BarackObama","Dreamers have contributed so much to our country, and they are risking their lives fighting on the frontlines of this pandemic. They deserve permanent immigration status and a pathway to citizenship—as they are Americans in every way but on paper. https://t.co/e4IYqX3WIy","Barack Obama","Washington, DC",FALSE,2020-04-13
2020-04-13 15:33:36,"BarackObama","We can't deny that racial and socioeconomic factors are playing a role in who is being hit the hardest by the virus. It's a reminder for our policymakers to keep our most vulnerable communities at the forefront when making decisions.
https://t.co/aipc8p7Hwh","Barack Obama","Washington, DC",FALSE,2020-04-13
2020-04-12 14:41:33,"BarackObama","Although our celebrations may look different this year, our unwavering faith remains the same. For me, Easter is a time of hope––a reminder of rebirth and renewal––and a belief in a better day to come. From my family to yours, we wish you all a blessed and joyful Easter. https://t.co/xEsgxOarQ5","Barack Obama","Washington, DC",FALSE,2020-04-12
2020-04-10 21:08:07,"BarackObama","Let’s not use the tragedy of a pandemic to compromise our democracy. Check the facts of vote by mail. https://t.co/aTNxRV4Ws3","Barack Obama","Washington, DC",FALSE,2020-04-10
2020-04-10 21:08:06,"BarackObama","Everyone should have the right to vote safely, and we have the power to make that happen. This shouldn't be a partisan issue. https://t.co/gL38DpYEmu","Barack Obama","Washington, DC",FALSE,2020-04-10
2020-04-10 21:08:05,"BarackObama","No one should be forced to choose between their right to vote and their right to stay healthy like the debacle in Wisconsin this week. https://t.co/fbDCbOb9qN","Barack Obama","Washington, DC",FALSE,2020-04-10
2020-04-10 13:50:02,"BarackObama","Some good news: states that started social distancing early and aggressively, like California, have avoided overwhelmed health care systems. It’s critical that we continue to listen to the evidence and experts and practice social distancing. https://t.co/56RgGeAfr7","Barack Obama","Washington, DC",FALSE,2020-04-10
2020-04-09 21:00:27,"BarackObama","Mayors have been working hard to help us get through this pandemic, and they’ll have just as big a task to help people through hard times ahead. I spent some time with many of them today to thank them for their efforts, and asked them to keep up the good work. https://t.co/YzqPMPo8m2","Barack Obama","Washington, DC",FALSE,2020-04-09
2020-04-08 21:18:19,"BarackObama","Through centuries of persecution, exile and struggle, the story of Passover has reminded the Jewish people––and all of humanity––of the power to overcome even the greatest of odds. Michelle and I send our warmest wishes to those celebrating with loved ones at home or virtually.","Barack Obama","Washington, DC",FALSE,2020-04-08
2020-04-08 14:15:54,"BarackObama","Social distancing bends the curve and relieves some pressure on our heroic medical professionals. But in order to shift off current policies, the key will be a robust system of testing and monitoring – something we have yet to put in place nationwide. https://t.co/evkTSrzReB","Barack Obama","Washington, DC",FALSE,2020-04-08
2020-04-07 18:40:15,"BarackObama","My advisor and friend @cecmunoz has been someone I’ve turned to for years. In her new book, More Than Ready, she shares her story and an empowering message to women, especially women of color, that they are the leaders we need to make a change in our world. https://t.co/6bQski6N23","Barack Obama","Washington, DC",FALSE,2020-04-07
2020-04-07 16:02:23,"BarackObama","It’s World Health Day, and we owe a profound debt of gratitude to all our medical professionals. They’re still giving their all for us every day, at great risk to themselves, and we can’t thank them enough for their bravery and their service.","Barack Obama","Washington, DC",FALSE,2020-04-07
2020-04-06 22:54:01,"BarackObama","Bill Withers was a true American master. His music, rooted in the everyday joys and sorrows of working people, was soulful, wise and life-affirming––a perfect tonic for hard times. https://t.co/P8cusIny4k","Barack Obama","Washington, DC",FALSE,2020-04-06
2020-04-06 18:45:29,"BarackObama","As she often does, @SenWarren provides a cogent summary of how federal policymakers should be thinking about the pandemic in the coming months. https://t.co/zkX0E7ncK5","Barack Obama","Washington, DC",FALSE,2020-04-06
2020-04-01 14:47:48,"BarackObama","It's Census Day and we all have a crucial role to play. Filling out the 2020 Census determines what the next decade will look like for your community: your roads, health care, schools, representation and more. Takes a few minutes by mail, phone or online. https://t.co/KzxFJKavmM","Barack Obama","Washington, DC",FALSE,2020-04-01
2020-03-31 15:19:04,"BarackObama","We've seen all too terribly the consequences of those who denied warnings of a pandemic. We can't afford any more consequences of climate denial. All of us, especially young people, have to demand better of our government at every level and vote this fall. https://t.co/K8Ucu7iVDK","Barack Obama","Washington, DC",FALSE,2020-03-31
2020-03-30 17:03:55,"BarackObama","So many Americans right now are stepping up to help their communities. Zohaib Begg, a 7-year-old from VA, is one of them. This inspiring kid has been gathering supplies from hotels to donate to the medical professionals at his local hospital. https://t.co/K8Pvp9Cyaq","Barack Obama","Washington, DC",FALSE,2020-03-30
2020-03-28 19:56:14,"BarackObama","We are grateful for what he did for this country. He carried the baton longer and surer than almost anybody. It falls to the rest of us now to pick it up and never stop moving forward until we finish what he started—that journey to justice.","Barack Obama","Washington, DC",FALSE,2020-03-28
2020-03-28 19:56:14,"BarackObama","What a joy it was to watch him pray and preach. I took heart in him saying, “We ain’t going back. We’ve come too far, marched too long, prayed too hard, wept too bitterly, bled too profusely, and died too young to let anybody turn back the clock on our journey to justice.”","Barack Obama","Washington, DC",FALSE,2020-03-28
2020-03-28 19:56:13,"BarackObama","Rev. Joseph Lowery was a giant who let so many of us stand on his shoulders. With boundless generosity, patience, and moral courage, he encouraged a new generation of activists and leaders. Michelle and I remember him fondly today, and our love and prayers are with his family. https://t.co/xxjY2habOm","Barack Obama","Washington, DC",FALSE,2020-03-28
2020-03-27 17:43:32,"BarackObama","During this crisis, our grocery store clerks, delivery drivers, transit and utility workers—along with so many others—have been selflessly getting up every day to make sure we have the things we need. And for that, we say thank you.
https://t.co/Fq5qIRXt03","Barack Obama","Washington, DC",FALSE,2020-03-27
2020-03-26 00:00:34,"BarackObama","And this article provides a great example of the kind of community spirit that we need to get through this—a spirit that we can hopefully learn to instill more of into our lives, workplaces, civic institutions, and government once the crisis has passed. https://t.co/xYZvspW4Ug","Barack Obama","Washington, DC",FALSE,2020-03-26
2020-03-26 00:00:33,"BarackObama","Here’s a useful overview of the likely scenarios that the world will be facing in the coming months while managing this pandemic. So much depends on our ability to make good decisions going forward along with our ability to remain resilient. https://t.co/uYpP1KfOUs","Barack Obama","Washington, DC",FALSE,2020-03-26
2020-03-25 14:11:51,"BarackObama","These are the burdens our medical heroes already face in NYC. It's only going to get harder across the country. Another reason to maintain social distancing policies at least until we have comprehensive testing in place. Not just for our sake—for theirs. https://t.co/bwNXhOPMYs","Barack Obama","Washington, DC",FALSE,2020-03-25
2020-03-24 16:50:08,"BarackObama","Our medical professionals are heroes putting their lives on the line to keep our country going. Here's a look at how an ER doctor who already fought on the front lines of one crisis makes it through a day in this one. A good reminder for us to help them out by staying home. https://t.co/ah7vva9776","Barack Obama","Washington, DC",FALSE,2020-03-24
2020-03-23 15:43:41,"BarackObama","Here’s a useful summary of the current best thinking among public health experts on how we need to approach the fight against COVID-19 in the coming weeks. https://t.co/7cy71sKLVG","Barack Obama","Washington, DC",FALSE,2020-03-23
2020-03-23 14:41:49,"BarackObama","Ten years ago today, I signed the Affordable Care Act into law. It protected preexisting conditions, cut the uninsured rate in half, and lots more. But it's still under political attack right when we need care the most. We have to protect it, build on it, until we cover everyone. https://t.co/zz2v3DzMgq","Barack Obama","Washington, DC",FALSE,2020-03-23
2020-03-21 13:24:06,"BarackObama","Sometimes it takes the wisdom and resilience of those who have been marginalized for all of us to remember the importance of community and mutual aid.","Barack Obama","Washington, DC",FALSE,2020-03-21
2020-03-21 13:24:06,"BarackObama","And @cripchick, a disabled activist, understands what it’s like for people with particular vulnerabilities to come together for support:
https://t.co/aBAuBoMYFm","Barack Obama","Washington, DC",FALSE,2020-03-21
2020-03-21 13:24:05,"BarackObama",".@sullydish witnessed the impact of HIV-AIDS on the LGBT community in the early stages of that devastating disease: https://t.co/j0ipIrzoDC","Barack Obama","Washington, DC",FALSE,2020-03-21
2020-03-21 13:24:05,"BarackObama","Here are a few stories that have less to do with the very real medical or economic aspects of this crisis, and more with how we take care of each other as a human family during all crises:","Barack Obama","Washington, DC",FALSE,2020-03-21
2020-03-19 15:25:09,"BarackObama","The best part of my job was meeting people like this—ready to make a selfless act in a time of need. Many Americans are already making deep sacrifices to keep our communities healthy, but if you’re able to, consider helping those hit the hardest. https://t.co/CdrMsC6VXF","Barack Obama","Washington, DC",FALSE,2020-03-19
2020-03-19 15:25:09,"BarackObama",".@rgay and @SheaSerrano are using their feeds to directly support people in need—and helping shift our ideas about how to approach giving.
https://t.co/1JHPUYEiKV","Barack Obama","Washington, DC",FALSE,2020-03-19
2020-03-19 15:25:08,"BarackObama","In my old neighborhood, the @BSAllianceChi established a crisis pantry to provide food and essential items for particularly vulnerable queer and trans residents on the South and West sides of Chicago.
https://t.co/ilyDlj3ago","Barack Obama","Washington, DC",FALSE,2020-03-19
2020-03-19 15:25:07,"BarackObama",".@ObamaFoundation Fellow @alexsmith1982 is helping seniors fight loneliness in the UK through a mix of new and old technology: online chats through Zoom and Skype, and postcards and poems shared by younger neighbors.
https://t.co/GdnqDR8JJ4","Barack Obama","Washington, DC",FALSE,2020-03-19
2020-03-19 15:25:07,"BarackObama","Some great stories of big-hearted people coming up with new ways to come together—even while remaining apart—to help the vulnerable who face some very tough times ahead.
https://t.co/kcBQK915jo","Barack Obama","Washington, DC",FALSE,2020-03-19
2020-03-18 14:57:45,"BarackObama","In the meantime, remember to check up by phone on elderly or vulnerable friends and neighbors who may need our help.","Barack Obama","Washington, DC",FALSE,2020-03-18
2020-03-18 14:57:44,"BarackObama","As communities have begun to recognize the importance of social distancing measures to “flatten the curve” on COVID-19 transmission, here’s a sober but useful primer on what we should expect in the coming months: https://t.co/9oqdRF5J0Q","Barack Obama","Washington, DC",FALSE,2020-03-18
2020-03-17 16:49:38,"BarackObama","We owe a profound debt of gratitude to all our health professionals and everybody who’ll be on the front lines of this pandemic for a long while. They’re giving everything. May we all model our own behavior on their selflessness and sacrifice as we help each other through this. https://t.co/F3tsJTqd4c","Barack Obama","Washington, DC",FALSE,2020-03-17
2020-03-15 19:09:21,"BarackObama","Not everybody can stay home, and we owe a big debt of gratitude to health professionals, transit and airport workers, first responders, and everyone keeping our communities going. Leaders have to step up to support people whose lives and livelihoods take a hit in the weeks ahead.","Barack Obama","Washington, DC",FALSE,2020-03-15
2020-03-15 19:08:57,"BarackObama","Watch this. It shows why we should all do the right thing and stay home to the fullest extent possible. All of us can help slow the spread of the virus, protecting the elderly, the vulnerable, and each other. https://t.co/FgffQrMVB7","Barack Obama","Washington, DC",FALSE,2020-03-15
2020-03-14 14:11:06,"BarackObama","A shout out to Kevin, Giannis, Zion, Blake, Steph and all the players, owners and organizations who are setting a good example during a challenging time. A reminder that we’re a community, and that each of us has an obligation to look out for each other. https://t.co/cv1RZi9GGL","Barack Obama","Washington, DC",FALSE,2020-03-14
2020-03-12 23:00:56,"BarackObama","If you’re wondering whether it’s an overreaction to cancel large gatherings and public events (and I love basketball), here’s a useful primer as to why these measures can slow the spread of the virus and save lives. We have to look out for each other. https://t.co/Ld7Uc8sPTQ","Barack Obama","Washington, DC",FALSE,2020-03-12
2020-03-10 20:50:11,"BarackObama","In the midst of campaign season, it’s important to look squarely at what’s at stake. This article speaks to one of the disturbing long term trends that we as voters and citizens need to expect our government to address. https://t.co/m49rbES0i6","Barack Obama","Washington, DC",FALSE,2020-03-10
2020-03-07 15:18:26,"BarackObama","55 years ago, when a group of civil rights organizers crossed the Edmund Pettus Bridge, they carried America with them. Today, let's honor that legacy by continuing their work to protect and exercise our foundational right to vote. https://t.co/zhMeTA3kFj","Barack Obama","Washington, DC",FALSE,2020-03-07
2020-03-04 16:52:19,"BarackObama","Protect yourself and your community from coronavirus with common sense precautions: wash your hands, stay home when sick and listen to the @CDCgov and local health authorities. Save the masks for health care workers. Let’s stay calm, listen to the experts, and follow the science.","Barack Obama","Washington, DC",FALSE,2020-03-04
2020-03-03 21:34:30,"BarackObama","Michelle and I are sending our prayers to those affected by the severe storms in Tennessee, especially to those who lost loved ones. Our hearts are with you and the first responders working so diligently to protect the vibrant communities of Nashville.","Barack Obama","Washington, DC",FALSE,2020-03-03
2020-02-28 15:49:05,"BarackObama","America needs you as states prepare for the next round of redistricting. It's up to all of us to make sure we have a fair democracy. Join me in the fight for fair maps.
  
Join me and @allontheline today: https://t.co/bTF7myfK5s","Barack Obama","Washington, DC",FALSE,2020-02-28
2020-02-28 15:48:25,"BarackObama","Shirley Chisholm said ""You don't make progress by standing on the sidelines, whimpering and complaining. You make progress by implementing ideas.""
  
All across this country, right now, people are coming together to create extraordinary change. https://t.co/YTTfJYrYXW","Barack Obama","Washington, DC",FALSE,2020-02-28
2020-02-24 21:57:19,"BarackObama","After a lifetime of reaching for the stars, today, Katherine Johnson landed among them. She spent decades as a hidden figure, breaking barriers behind the scenes. But by the end of her life, she had become a hero to millions—including Michelle and me. https://t.co/isG29nwBiB","Barack Obama","Washington, DC",FALSE,2020-02-24
2020-02-21 15:34:33,"BarackObama","Happy birthday to one of my heroes — someone who believed our right to vote was more important than his own life. Thanks for making good trouble for 80 years, @repjohnlewis. https://t.co/LqMuvmpbLp","Barack Obama","Washington, DC",FALSE,2020-02-21
2020-02-19 00:51:40,"BarackObama","https://t.co/AQJsfBf0ri","Barack Obama","Washington, DC",FALSE,2020-02-19
2020-02-19 00:51:21,"BarackObama","Here are a couple of articles that are worth reading — from housing to health, these stories use data to explore challenges we face and demonstrate how policy solutions along with civic engagement can make a real difference in people’s lives.
https://t.co/G6EIUwuMqV","Barack Obama","Washington, DC",FALSE,2020-02-19
2020-02-17 15:46:53,"BarackObama","Eleven years ago today, near the bottom of the worst recession in generations, I signed the Recovery Act, paving the way for more than a decade of economic growth and the longest streak of job creation in American history. https://t.co/BmdXrxUAUf","Barack Obama","Washington, DC",FALSE,2020-02-17
2020-02-14 17:40:29,"BarackObama","Happy Valentine’s Day to my forever dance partner, @MichelleObama. https://t.co/lHvTGUwEHr","Barack Obama","Washington, DC",FALSE,2020-02-14
2020-02-13 15:31:32,"BarackObama","What a great example of citizenship, what each of us can do to make a difference for all of us: https://t.co/YxsvONUuVl","Barack Obama","Washington, DC",FALSE,2020-02-13
2020-02-11 21:05:32,"BarackObama","Even if the methods are new, sowing the seeds of doubt, division, and discord to turn Americans against each other is an old trick. The antidote is citizenship: to get engaged, organized, mobilized, and to vote - on every level, in every election. https://t.co/yOvaCZYtrW","Barack Obama","Washington, DC",FALSE,2020-02-11
2020-02-11 18:09:29,"BarackObama","Thirty years on, I remember the hope we all felt watching Mandela’s release from prison. The gift of a new way of seeing. The chance to participate in the work of building a better world. The ultimate example of perseverance and faith for each new generation to follow.","Barack Obama","Washington, DC",FALSE,2020-02-11
2020-02-10 02:38:19,"BarackObama","Congrats to Julia and Steven, the filmmakers behind American Factory, for telling such a complex, moving story about the very human consequences of wrenching economic change. Glad to see two talented and downright good people take home the Oscar for Higher Ground’s first release. https://t.co/W4AZ68iWoY","Barack Obama","Washington, DC",FALSE,2020-02-10
2020-02-01 20:36:40,"BarackObama","Sixty years ago today, the Greensboro Four stood up to injustice by sitting down at a lunch counter. Our journey is full of such stories; of acts of patriotic protest that challenge this country we love to live up to our highest ideals, however long it takes. #BlackHistoryMonth","Barack Obama","Washington, DC",FALSE,2020-02-01
