"created_at","screen_name","text","name","location","is_retweet","date"
2015-06-19 20:12:26,"BarackObama","The EPA's standards for trucks will save billions of dollars while decreasing carbon pollution: http://t.co/8r50Jx68md #ActOnClimate","Barack Obama","Washington, DC",FALSE,2015-06-19
2015-06-19 18:30:51,"BarackObama","Legislators across the country are consistently attacking women's rights. It's time to fight back: http://t.co/ce1vuZPBdG #StandWithWomen","Barack Obama","Washington, DC",FALSE,2015-06-19
2015-06-19 16:24:54,"BarackObama","Reducing carbon pollution is a job creator. Read more from @GinaEPA: http://t.co/QDZrPU0UB2 #ActOnClimate","Barack Obama","Washington, DC",FALSE,2015-06-19
2015-06-18 16:21:23,"BarackObama","LIVE: President Obama is delivering a statement on the shooting in South Carolina. http://t.co/bM8ZaurUeK","Barack Obama","Washington, DC",FALSE,2015-06-18
2015-06-18 02:45:51,"BarackObama","""From my family to yours, Ramadan Kareem."" —President Obama","Barack Obama","Washington, DC",FALSE,2015-06-18
2015-06-17 22:14:10,"BarackObama","Find out why it's economically beneficial to #ActOnClimate from @GinaEPA: http://t.co/8JzVHYpKg2","Barack Obama","Washington, DC",FALSE,2015-06-17
2015-06-17 19:27:19,"BarackObama","Follow up: More on bees. http://t.co/PFpy4y8OCR","Barack Obama","Washington, DC",FALSE,2015-06-17
2015-06-17 17:32:56,"BarackObama","This is an ongoing battle. Be on the front lines of the fight for women's rights: http://t.co/es4zz8v1CB #StandWithWomen","Barack Obama","Washington, DC",FALSE,2015-06-17
2015-06-17 15:32:10,"BarackObama","In only three months, state legislators introduced 332 provisions restricting choice: http://t.co/PHXXDJZOue #StandWithWomen","Barack Obama","Washington, DC",FALSE,2015-06-17
2015-06-16 20:36:43,"BarackObama","Investing in the clean energy industry is an important way to #ActOnClimate. http://t.co/aSEpaFiSMj","Barack Obama","Washington, DC",FALSE,2015-06-16
2015-06-16 16:57:54,"BarackObama","These investments put us $4 billion closer to clean energy solutions: http://t.co/f2xr2nsJW1 #ActOnClimate","Barack Obama","Washington, DC",FALSE,2015-06-16
2015-06-15 22:48:05,"BarackObama","Let's. Go. Hawks. http://t.co/igbbXwVMjx","Barack Obama","Washington, DC",FALSE,2015-06-15
2015-06-15 20:04:24,"BarackObama","Economic growth is just one way #DACAworks. See how your state will benefit from more #ImmigrationAction: http://t.co/5grtIZKm7H","Barack Obama","Washington, DC",FALSE,2015-06-15
2015-06-15 18:39:42,"BarackObama","Because #DACAworks, hundreds of thousands of young people are closer to the American dream. http://t.co/9P1GrqUz2j","Barack Obama","Washington, DC",FALSE,2015-06-15
2015-06-14 21:21:58,"BarackObama","""On Flag Day ... we pay tribute to this banner of hope and opportunity."" —President Obama #FlagDay http://t.co/K3JLzM7HT7","Barack Obama","Washington, DC",FALSE,2015-06-14
2015-06-13 21:33:16,"BarackObama","""Trade that’s fair and free and smart will grow opportunity for our middle class."" —President Obama http://t.co/pJI3V2Nn7J #LeadOnTrade","Barack Obama","Washington, DC",FALSE,2015-06-13
2015-06-13 20:20:36,"BarackObama","In the weekly address, the President discusses our growing economy and why it's so important that we #LeadOnTrade: http://t.co/pJI3V2Nn7J","Barack Obama","Washington, DC",FALSE,2015-06-13
2015-06-12 20:19:08,"BarackObama","States like Hawaii are leading the fight against climate change: http://t.co/V5Z9p0EuFr #SwitchToClean","Barack Obama","Washington, DC",FALSE,2015-06-12
2015-06-12 16:22:58,"BarackObama","Read why President John F. Kennedy believed trade was integral to America’s prosperity and security: http://t.co/0AGe8Ud1QX #LeadOnTrade","Barack Obama","Washington, DC",FALSE,2015-06-12
2015-06-12 15:40:22,"BarackObama","This is what's at stake for workers across the country if Congress votes no on expanding TAA: http://t.co/AdFNJVUny0","Barack Obama","Washington, DC",FALSE,2015-06-12
2015-06-12 13:54:26,"BarackObama","For 41 years, TAA has been a lifeline for millions of workers. Today, Congress can make sure that lifeline continues. http://t.co/7ljmipUAuq","Barack Obama","Washington, DC",FALSE,2015-06-12
2015-06-12 11:49:57,"BarackObama","From @CarolineKennedy: Why it's so important for the United States to #LeadOnTrade: http://t.co/UUt18RoRWo","Barack Obama","Washington, DC",FALSE,2015-06-12
2015-06-11 21:05:08,"BarackObama","200 trillion gallons of rain fell in May—the wettest month on record. http://t.co/87oGgLFiJt #ActOnClimate","Barack Obama","Washington, DC",FALSE,2015-06-11
2015-06-11 19:08:17,"BarackObama","Expanding #CollegeOpportunity is vital to America's success in a global economy: http://t.co/EmQaPg9iP4","Barack Obama","Washington, DC",FALSE,2015-06-11
2015-06-11 15:21:31,"BarackObama","Climate change is already affecting our communities. That's why the President is taking steps to #ActOnClimate now. http://t.co/2VhVCQ2E7p","Barack Obama","Washington, DC",FALSE,2015-06-11
2015-06-10 21:40:54,"BarackObama","Hawaii just set a goal of generating 100 percent of its electricity from renewable resources: http://t.co/CMcQu38tqg #SwitchToClean","Barack Obama","Washington, DC",FALSE,2015-06-10
2015-06-10 19:50:33,"BarackObama","This is how #Obamacare is making health care in America better: http://t.co/d6vL0tdZZo","Barack Obama","Washington, DC",FALSE,2015-06-10
2015-06-10 15:48:12,"BarackObama","Stand up for expanding #CollegeOpportunity for hard-working students: http://t.co/zD5JOnJJGI http://t.co/zM8PssQz6p","Barack Obama","Washington, DC",FALSE,2015-06-10
2015-06-09 22:20:39,"BarackObama","""It’s up to all of us ... to help make the right to health care a reality for all Americans."" —President Obama #ACAWorks","Barack Obama","Washington, DC",FALSE,2015-06-09
2015-06-09 19:05:16,"BarackObama","According to a recent poll, a clear majority of Americans don't want federal #Obamacare subsidies rolled back: http://t.co/4aYVdAzKVh","Barack Obama","Washington, DC",FALSE,2015-06-09
2015-06-09 15:59:24,"BarackObama","LIVE: President Obama is speaking about the benefits of #Obamacare at @TheCHAUSA. http://t.co/uw5wjjNKbZ","Barack Obama","Washington, DC",FALSE,2015-06-09
2015-06-09 14:52:35,"BarackObama","Tune in at 11:50 a.m. ET to watch the President discuss how #Obamacare has improved our health care system: http://t.co/UaLtzkNlMV","Barack Obama","Washington, DC",FALSE,2015-06-09
2015-06-08 22:52:48,"BarackObama","Celebrate #NationalBestFriendsDay with the person who brings out the best in you. http://t.co/OVa0I0ItC9","Barack Obama","Washington, DC",FALSE,2015-06-08
2015-06-08 17:40:01,"BarackObama","Read why former U.S. Trade Representative Ron Kirk thinks it's time for the United States to #LeadOnTrade: http://t.co/TU84un00UH","Barack Obama","Washington, DC",FALSE,2015-06-08
2015-06-08 14:49:45,"BarackObama","Stand up for expanding #CollegeOpportunity for hard-working students: http://t.co/pTyByoRWiB http://t.co/6CzJziVTGw","Barack Obama","Washington, DC",FALSE,2015-06-08
2015-06-06 20:47:14,"BarackObama","""I’m going to keep doing everything I can to make our immigration system more just and more fair."" —President Obama http://t.co/c3jcEOtLEA","Barack Obama","Washington, DC",FALSE,2015-06-06
2015-06-06 19:41:18,"BarackObama","In the weekly address, the President discusses #ImmigrantHeritageMonth and fixing our broken immigration system. http://t.co/FCQz6tgz7F","Barack Obama","Washington, DC",FALSE,2015-06-06
2015-06-06 16:38:59,"BarackObama","""Beau Biden was an original. He was a good man. A man of character. A man who loved deeply and was loved in return."" —President Obama","Barack Obama","Washington, DC",FALSE,2015-06-06
2015-06-06 14:46:25,"BarackObama","Read a few wise words from Beau Biden, and see the incredible legacy he leaves behind. http://t.co/2o25fkyn76","Barack Obama","Washington, DC",FALSE,2015-06-06
2015-06-05 19:41:45,"BarackObama","If you think access to higher education is a key to success, stand up for #CollegeOpportunity: http://t.co/ln9TxHN6o9 http://t.co/EoFGRvRTj5","Barack Obama","Washington, DC",FALSE,2015-06-05
2015-06-05 18:14:29,"BarackObama","With higher hourly wages and 280,000 new jobs, May's jobs report is good news for our economy. http://t.co/3IT8WkRfrZ","Barack Obama","Washington, DC",FALSE,2015-06-05
2015-06-05 17:15:32,"BarackObama","If all 50 states expanded Medicaid, they would save billions of dollars and thousands of lives. Read more: http://t.co/BLmQTiWqKW","Barack Obama","Washington, DC",FALSE,2015-06-05
2015-06-05 13:45:31,"BarackObama","The economy added 280,000 jobs in May—marking 63 consecutive months of private-sector job growth.","Barack Obama","Washington, DC",FALSE,2015-06-05
2015-06-04 19:08:30,"BarackObama","There's been a lot of progress on LGBT equality, but there's more work to do. Add your name to join the fight: http://t.co/gxSBV0KY8c","Barack Obama","Washington, DC",FALSE,2015-06-04
2015-06-04 15:17:58,"BarackObama","This shouldn't be a partisan issue. It's time to #ActOnClimate. http://t.co/iOsR9roqLd","Barack Obama","Washington, DC",FALSE,2015-06-04
2015-06-03 19:55:22,"BarackObama","It's more fun to run with a friend. #NationalRunningDay http://t.co/3ywdYQtL4i","Barack Obama","Washington, DC",FALSE,2015-06-03
2015-06-03 17:26:16,"BarackObama","Keep the momentum going in the fight for equality. Add your name now: http://t.co/i3keRtNN1d http://t.co/rIpdOwSozk","Barack Obama","Washington, DC",FALSE,2015-06-03
2015-06-03 15:20:33,"BarackObama","Here's one way to spark change: Share what LGBT equality means to you. http://t.co/NBMdHNqUnG","Barack Obama","Washington, DC",FALSE,2015-06-03
2015-06-02 21:14:27,"BarackObama","Join the team that's fighting for LGBT equality: http://t.co/p8ssh2vgKS http://t.co/9jpzHSphzC","Barack Obama","Washington, DC",FALSE,2015-06-02
2015-06-02 18:50:03,"BarackObama","People across the country are #WearingOrange today to stand up against gun violence. http://t.co/qmFvPuYmFU","Barack Obama","Washington, DC",FALSE,2015-06-02
2015-06-02 16:35:11,"BarackObama","When all Americans are treated equally—no matter who they are or whom they love—our country will be a better place. http://t.co/KmQ9Ugo7eV","Barack Obama","Washington, DC",FALSE,2015-06-02
2015-06-01 21:36:58,"BarackObama","Your story matters in the fight for LGBT rights—share it here: http://t.co/FjAdgfkW0D","Barack Obama","Washington, DC",FALSE,2015-06-01
2015-06-01 21:33:30,"BarackObama","It takes courage to share your story. https://t.co/Q7wWjV9Rxx","Barack Obama","Washington, DC",FALSE,2015-06-01
2015-06-01 18:37:47,"BarackObama","Be on the right side of history. Add your name to continue the fight for equality: http://t.co/08I1PRCsAM #LoveIsLove","Barack Obama","Washington, DC",FALSE,2015-06-01
2015-06-01 16:32:55,"BarackObama","Happy Pride Month. #LoveIsLove http://t.co/cpbspiyr7e","Barack Obama","Washington, DC",FALSE,2015-06-01
2015-05-31 17:01:48,"BarackObama","""For all that Beau Biden achieved in his life ... nothing claimed a fuller focus of his love and devotion than his family."" —President Obama","Barack Obama","Washington, DC",FALSE,2015-05-31
2015-05-30 13:54:38,"BarackObama","Watch President Obama address key national security measures and reforms in the weekly address: http://t.co/rFunNqIFLV","Barack Obama","Washington, DC",FALSE,2015-05-30
2015-05-29 21:22:44,"BarackObama","Add your name to join the team fighting back against climate change denial: http://t.co/JNEXVHyT0q #ActOnClimate http://t.co/Hbu3cZcUgR","Barack Obama","Washington, DC",FALSE,2015-05-29
2015-05-29 19:46:03,"BarackObama","""Let us carry his legacy forward."" —President Obama on President John F. Kennedy, born 98 years ago today http://t.co/6lvHCwe9qW","Barack Obama","Washington, DC",FALSE,2015-05-29
2015-05-29 17:16:07,"BarackObama","Another reason why health care reform is so important to millions of Americans. http://t.co/9A0mRMXsqL","Barack Obama","Washington, DC",FALSE,2015-05-29
2015-05-29 14:32:36,"BarackObama","New clean water provisions will help protect the health of 117 million Americans. Read more: http://t.co/7qXT338jls #CleanWaterRules","Barack Obama","Washington, DC",FALSE,2015-05-29
2015-05-28 21:13:33,"BarackObama","Read this blog from @GinaEPA and Jo-Ellen Darcy on why protecting water sources is so important: http://t.co/gGqsIgvegm #CleanWaterRules","Barack Obama","Washington, DC",FALSE,2015-05-28
2015-05-28 19:21:39,"BarackObama","Enforceable labor and environmental protections are just a couple of reasons why America needs to #LeadOnTrade. http://t.co/4THWZFdRHh","Barack Obama","Washington, DC",FALSE,2015-05-28
2015-05-28 16:47:30,"BarackObama","Read about the hurricane preparedness briefing the President is receiving in Miami today: http://t.co/NfRkw4p8l7 #ActOnClimate","Barack Obama","Washington, DC",FALSE,2015-05-28
2015-05-28 15:16:17,"BarackObama","A huge step forward in making sure our drinking water is clean. #CleanWaterRules http://t.co/yRZIOgss8Z","Barack Obama","Washington, DC",FALSE,2015-05-28
2015-05-27 22:14:16,"BarackObama","Read why #CleanWaterRules are essential to prevent pollution and protect our drinking waters: http://t.co/FXNuuAbJ5n","Barack Obama","Washington, DC",FALSE,2015-05-27
2015-05-27 20:47:28,"BarackObama","When 97 percent of climate scientists agree, it's time for the deniers to put politics aside and #ActOnClimate. http://t.co/mbHMhbVJK9","Barack Obama","Washington, DC",FALSE,2015-05-27
2015-05-27 15:09:45,"BarackObama","These #CleanWaterRules will protect America's drinking water from polluters. http://t.co/P643CfwEBV","Barack Obama","Washington, DC",FALSE,2015-05-27
2015-05-26 22:13:47,"BarackObama","Millions of Americans are counting on this. http://t.co/ncc9veKX6Q","Barack Obama","Washington, DC",FALSE,2015-05-26
2015-05-26 17:21:41,"BarackObama","Cities nationwide are answering the President's call to #LeadOnLeave and #RaiseTheWage: http://t.co/3VDPVvvCGz","Barack Obama","Washington, DC",FALSE,2015-05-26
2015-05-26 15:30:43,"BarackObama","The President is pursuing the most progressive trade agreement in U.S. history. You can help fight for it, too: http://t.co/uZvkgHBQ7J","Barack Obama","Washington, DC",FALSE,2015-05-26
2015-05-23 18:42:52,"BarackObama","""Americans gave everything they had—not for glory ... but for something greater than themselves."" —President Obama http://t.co/4xV5ajotkU","Barack Obama","Washington, DC",FALSE,2015-05-23
2015-05-23 17:09:22,"BarackObama","Today is the last day to get your application in for the @OFA Summer Fellowship program: http://t.co/KqmyRwmWOl","Barack Obama","Washington, DC",FALSE,2015-05-23
2015-05-23 15:47:31,"BarackObama","Watch President Obama pay tribute to the United States Armed Forces in the weekly address: http://t.co/NttY012PUi #MemorialDayWeekend","Barack Obama","Washington, DC",FALSE,2015-05-23
2015-05-22 20:57:53,"BarackObama","If the U.S. doesn't #LeadOnTrade, others will. Let's make sure America writes the rules in this global economy: http://t.co/BL15PXZBuC","Barack Obama","Washington, DC",FALSE,2015-05-22
2015-05-22 18:19:57,"BarackObama","America needs to lead the way and #ActOnClimate. http://t.co/w9QG9qPxF4 http://t.co/U3T5negdYn","Barack Obama","Washington, DC",FALSE,2015-05-22
2015-05-22 16:22:43,"BarackObama","The deadline to be part of the summer #OFAFellows program is tomorrow—apply here: http://t.co/yN8vcgQg7f","Barack Obama","Washington, DC",FALSE,2015-05-22
2015-05-22 14:59:23,"BarackObama","LIVE: The President is speaking to the Adas Israel Congregation in celebration of Jewish American Heritage Month. http://t.co/yHfyWCckLt","Barack Obama","Washington, DC",FALSE,2015-05-22
2015-05-21 22:36:57,"BarackObama","Love is winning: http://t.co/KjLt3A8mk3 #LoveIsLove http://t.co/0EdqRMaqXX","Barack Obama","Washington, DC",FALSE,2015-05-21
2015-05-21 20:48:36,"BarackObama","Read how the Obama administration is stepping up to protect honeybees and other pollinators: http://t.co/P6rMxeUq1L","Barack Obama","Washington, DC",FALSE,2015-05-21
2015-05-21 17:03:59,"BarackObama","Check out the President's speech at the United States Coast Guard Academy on why it's so important to #ActOnClimate: http://t.co/4Zxjs2v9ap","Barack Obama","Washington, DC",FALSE,2015-05-21
2015-05-21 15:06:13,"BarackObama","This is about making sure there's a level playing field for American workers in the global economy. http://t.co/kMibkh65YB #LeadOnTrade","Barack Obama","Washington, DC",FALSE,2015-05-21
2015-05-20 22:01:23,"BarackObama","TV won't be the same without Dave. http://t.co/9q5NHTf3b5","Barack Obama","Washington, DC",FALSE,2015-05-20
2015-05-20 19:55:21,"BarackObama","America needs to #LeadOnTrade. If you want trade policy that's tough, progressive, and transparent, add your name: http://t.co/xv3tZi1G4H","Barack Obama","Washington, DC",FALSE,2015-05-20
2015-05-20 16:18:51,"BarackObama","""This cannot be subject to the usual politics and the usual rhetoric."" —President Obama on climate change #ActOnClimate","Barack Obama","Washington, DC",FALSE,2015-05-20
2015-05-20 16:14:48,"BarackObama","""It will not be easy, it will require sacrifices, and the politics will be tough. But there is no other way."" —President Obama #ActOnClimate","Barack Obama","Washington, DC",FALSE,2015-05-20
2015-05-20 16:12:53,"BarackObama","""The only way the world is going to prevent the effects of climate change is to slow down the warming of the planet."" —President Obama","Barack Obama","Washington, DC",FALSE,2015-05-20
2015-05-20 16:10:23,"BarackObama","""Climate change—and especially rising seas—is a threat to our homeland security."" —President Obama #ActOnClimate","Barack Obama","Washington, DC",FALSE,2015-05-20
2015-05-20 16:08:33,"BarackObama","""Denying it or refusing to deal with it endangers our national security."" —President Obama on climate change #ActOnClimate","Barack Obama","Washington, DC",FALSE,2015-05-20
2015-05-20 16:05:16,"BarackObama","""Cadets, the threat of a changing climate cuts to the very core of your service."" —President Obama to the U.S. Coast Guard Academy graduates","Barack Obama","Washington, DC",FALSE,2015-05-20
2015-05-20 16:02:22,"BarackObama","""The planet is getting warmer. Fourteen of the 15 hottest years on record have been in the past 15 years."" —President Obama #ActOnClimate","Barack Obama","Washington, DC",FALSE,2015-05-20
2015-05-20 15:57:32,"BarackObama","""The best scientists in the world know that climate change is happening."" —President Obama #ActOnClimate","Barack Obama","Washington, DC",FALSE,2015-05-20
2015-05-20 15:43:17,"BarackObama","LIVE: President Obama is delivering the keynote address at the commencement ceremony of the U.S. Coast Guard Academy. http://t.co/bkb3Wwjzvi","Barack Obama","Washington, DC",FALSE,2015-05-20
2015-05-20 14:35:31,"BarackObama","Tune in at 11:35 a.m. ET to watch the President deliver a commencement speech at the U.S. Coast Guard Academy: http://t.co/0CUMi3p5BU","Barack Obama","Washington, DC",FALSE,2015-05-20
2015-05-19 20:03:31,"BarackObama","This is why health care reform matters. http://t.co/vc3R43veNk","Barack Obama","Washington, DC",FALSE,2015-05-19
2015-05-19 16:21:22,"BarackObama","Bees. http://t.co/gzqCOf1l0i","Barack Obama","Washington, DC",FALSE,2015-05-19
2015-05-19 15:05:25,"BarackObama","This is your opportunity to get your start in community organizing: http://t.co/XVzPFfiNX0","Barack Obama","Washington, DC",FALSE,2015-05-19
2015-05-18 20:40:02,"BarackObama","It's time to do away with Mad Men-era workplace policies—add your name if you agree: http://t.co/i5jzNPSEwi http://t.co/OOj85HZfYn","Barack Obama","Washington, DC",FALSE,2015-05-18
2015-05-18 18:48:50,"BarackObama","LIVE: President Obama is speaking to youth and local law enforcement in New Jersey. http://t.co/Mp3KIk8WO2","Barack Obama","Washington, DC",FALSE,2015-05-18
2015-05-18 17:57:00,"BarackObama","Welcome @POTUS, the official government account of the President of the United States.","Barack Obama","Washington, DC",FALSE,2015-05-18
2015-05-18 14:47:53,"BarackObama","What will it take for climate change deniers to #ActOnClimate? http://t.co/uN7gkOcpyM","Barack Obama","Washington, DC",FALSE,2015-05-18
2015-05-16 19:58:29,"BarackObama","""We want a place where you can make it if you try. That’s the promise we make to our young people."" —President Obama http://t.co/kCzW0tJFQg","Barack Obama","Washington, DC",FALSE,2015-05-16
2015-05-16 15:08:00,"BarackObama","In the weekly address, President Obama discusses the importance of expanding opportunity for all Americans: http://t.co/viCQAQZm4k","Barack Obama","Washington, DC",FALSE,2015-05-16
2015-05-15 22:08:29,"BarackObama","This is about leveling the playing field for American workers in the global economy—say it's time to #LeadOnTrade: http://t.co/6PwUby8jHz","Barack Obama","Washington, DC",FALSE,2015-05-15
2015-05-15 17:58:22,"BarackObama","You could be the next great grassroots organizer. Here's how: http://t.co/7dyYULsFmY #OFAFellows","Barack Obama","Washington, DC",FALSE,2015-05-15
2015-05-15 15:33:04,"BarackObama","""There’s going to be one killer blues session in heaven tonight."" —President Obama on the passing of #BBKing http://t.co/GD2yY6vymV","Barack Obama","Washington, DC",FALSE,2015-05-15
2015-05-14 22:14:55,"BarackObama","""When it comes to a woman's health, no politician should get to decide what's best for you."" —President Obama #NWHW http://t.co/IxN0WtNZ0E","Barack Obama","Washington, DC",FALSE,2015-05-14
2015-05-14 20:44:39,"BarackObama","This is a real step forward in creating a fair environment for the roughly 40 million Americans with student debt: http://t.co/8TdhanWMrF","Barack Obama","Washington, DC",FALSE,2015-05-14
2015-05-14 18:42:56,"BarackObama","It's the #GimmeFive challenge, presidential style. http://t.co/5ZLnuQ65ly","Barack Obama","Washington, DC",FALSE,2015-05-14
2015-05-14 17:20:33,"BarackObama","This shouldn't be an issue in 2015. #LeadOnLeave http://t.co/dJFCjxeS1R","Barack Obama","Washington, DC",FALSE,2015-05-14
2015-05-14 15:03:17,"BarackObama","Yumi used to think she couldn't make a difference—now she's helping DREAMers in her community. Read her story: http://t.co/LtBswxiF8o","Barack Obama","Washington, DC",FALSE,2015-05-14
2015-05-13 21:56:45,"BarackObama","It's time for the United States to #LeadOnTrade—add your name if you agree: http://t.co/qdytgxXBZo","Barack Obama","Washington, DC",FALSE,2015-05-13
2015-05-13 20:43:10,"BarackObama","America needs to #LeadOnTrade by making sure any deal lives up to our values. (graphic via @WhiteHouse) http://t.co/TqJAo0cGeH","Barack Obama","Washington, DC",FALSE,2015-05-13
2015-05-13 16:52:04,"BarackObama","""Our thoughts and prayers go out to the families and friends of those we lost last night."" —President Obama on the Amtrak derailment","Barack Obama","Washington, DC",FALSE,2015-05-13
2015-05-12 21:33:16,"BarackObama","Add your name if you think it's time to treat paid leave like the economic priority it is: http://t.co/C6uxNauhYK #LeadOnLeave","Barack Obama","Washington, DC",FALSE,2015-05-12
2015-05-12 19:34:37,"BarackObama","It's time to do better by working families. Let's #LeadOnLeave. http://t.co/fp5rw6y6of","Barack Obama","Washington, DC",FALSE,2015-05-12
2015-05-12 15:20:20,"BarackObama","Sign on if you agree that working families deserve paid leave: http://t.co/3FaJzk6cI8 #LeadOnLeave","Barack Obama","Washington, DC",FALSE,2015-05-12
2015-05-11 23:05:49,"BarackObama","NASA leads the world in the exploration and study of planets. Let's not let climate change deniers change that: http://t.co/dcUlvdFaha","Barack Obama","Washington, DC",FALSE,2015-05-11
2015-05-11 17:59:27,"BarackObama","As we continue to celebrate mothers, let's make sure workplace policies live up to what they deserve: http://t.co/hloGsujQfS #LeadOnLeave","Barack Obama","Washington, DC",FALSE,2015-05-11
2015-05-11 15:18:13,"BarackObama","It's time to give American workers the security of paid leave. #LeadOnLeave http://t.co/u0vythSZ0g","Barack Obama","Washington, DC",FALSE,2015-05-11
2015-05-09 15:52:25,"BarackObama","""We will be forever grateful for what these remarkable men and women did."" —President Obama http://t.co/C3Rg4rkRyv","Barack Obama","Washington, DC",FALSE,2015-05-09
2015-05-09 14:50:43,"BarackObama","WATCH: President Obama honors the 70th anniversary of VE Day in the weekly address: http://t.co/vMm2UxSIFt","Barack Obama","Washington, DC",FALSE,2015-05-09
2015-05-08 20:26:27,"BarackObama","President Obama visits his 50th state today. See White House photographer @PeteSouza's gallery from the first 49: http://t.co/mQwCsZEcqM","Barack Obama","Washington, DC",FALSE,2015-05-08
2015-05-08 18:49:16,"BarackObama","In the last 62 months, over 12.3 million private-sector jobs have been added to the economy. Read more: http://t.co/f0QrgOt1iB","Barack Obama","Washington, DC",FALSE,2015-05-08
2015-05-08 17:20:31,"BarackObama","""When the playing field is level, nobody beats the United States of America."" —President Obama #LeadOnTrade","Barack Obama","Washington, DC",FALSE,2015-05-08
2015-05-08 17:16:21,"BarackObama","""If any agreement undercuts working families—I wouldn’t sign it."" —President Obama #LeadOnTrade","Barack Obama","Washington, DC",FALSE,2015-05-08
2015-05-08 17:12:23,"BarackObama","""If you are opposed to these smart, progress trade deals, that means you must be satisfied with the status quo."" —President Obama","Barack Obama","Washington, DC",FALSE,2015-05-08
2015-05-08 17:00:21,"BarackObama","""We have to make sure America writes the rules of the global economy."" —President Obama #LeadOnTrade","Barack Obama","Washington, DC",FALSE,2015-05-08
2015-05-08 16:59:43,"BarackObama","""If we don't write the rules for trade around the world, guess what: China will."" —President Obama #LeadOnTrade","Barack Obama","Washington, DC",FALSE,2015-05-08
