"created_at","screen_name","text","name","location","is_retweet","date"
2015-12-09 20:19:51,"BarackObama","The world is #UnitedOnClimate. It's time to act. https://t.co/jvCIgpcDLi","Barack Obama","Washington, DC",FALSE,2015-12-09
2015-12-09 17:03:21,"BarackObama","LIVE: President Obama is delivering remarks at an event marking the 150th anniversary of the 13th Amendment. https://t.co/l13zAa8wtc","Barack Obama","Washington, DC",FALSE,2015-12-09
2015-12-09 16:06:17,"BarackObama","Tune in at 11:50 a.m. ET to watch President Obama commemorate the 150th anniversary of the 13th Amendment: https://t.co/c1k3kopsr3","Barack Obama","Washington, DC",FALSE,2015-12-09
2015-12-09 00:06:06,"BarackObama","Show your support for common-sense gun safety laws like closing the No-Fly List loophole: https://t.co/UsjEkfZQhb #DoSomething","Barack Obama","Washington, DC",FALSE,2015-12-09
2015-12-08 22:01:59,"BarackObama","Closing the No-Fly List loophole is a no-brainer. #DoSomething https://t.co/UzbNQbUnor","Barack Obama","Washington, DC",FALSE,2015-12-08
2015-12-08 20:46:44,"BarackObama","Hundreds of nations are coming together to stand #UnitedOnClimate—and you can join the conversation: https://t.co/98glwuXieP","Barack Obama","Washington, DC",FALSE,2015-12-08
2015-12-08 18:31:01,"BarackObama","The world is #UnitedOnClimate—it's time for climate change deniers in Congress to get on board. https://t.co/fayuoBVCmP","Barack Obama","Washington, DC",FALSE,2015-12-08
2015-12-08 17:00:27,"BarackObama","The world is standing #UnitedOnClimate. It's time to act. https://t.co/TRQStCSunY","Barack Obama","Washington, DC",FALSE,2015-12-08
2015-12-07 23:51:05,"BarackObama","Congress needs to close the No-Fly List loophole—add your name if you agree: https://t.co/FiKawWdQhQ #DoSomething","Barack Obama","Washington, DC",FALSE,2015-12-07
2015-12-07 18:36:02,"BarackObama","Congress can #DoSomething about this. https://t.co/0dhwrGu7wf","Barack Obama","Washington, DC",FALSE,2015-12-07
2015-12-07 01:02:19,"BarackObama","LIVE: President Obama is addressing the nation on the threat of terrorism and keeping the American people safe. https://t.co/6RzqPFT6or","Barack Obama","Washington, DC",FALSE,2015-12-07
2015-12-07 00:00:40,"BarackObama","Tune in at 8 p.m. ET to watch President Obama address the nation on keeping the American people safe: https://t.co/eYAoPgkacI","Barack Obama","Washington, DC",FALSE,2015-12-07
2015-12-05 20:39:46,"BarackObama","""Here in America it’s way too easy for dangerous people to get their hands on a gun."" —President Obama https://t.co/HlgAJbKSNt","Barack Obama","Washington, DC",FALSE,2015-12-05
2015-12-05 19:33:24,"BarackObama","WATCH: President Obama offers his condolences to the San Bernardino community and calls for common-sense gun laws. https://t.co/z5WRw1ciyf","Barack Obama","Washington, DC",FALSE,2015-12-05
2015-12-04 22:00:21,"BarackObama","Obamacare is helping millions. Repealing it would be devastating to families across the country. https://t.co/ShHxBdEdZq","Barack Obama","Washington, DC",FALSE,2015-12-04
2015-12-04 20:29:39,"BarackObama","Provisions in #Obamacare have helped save billions of dollars and more than 80,000 lives. Read more: https://t.co/qP0MHE41fo","Barack Obama","Washington, DC",FALSE,2015-12-04
2015-12-04 18:07:53,"BarackObama","Employers have added an average of 213,000 jobs a month over the past six months. We have to keep up this progress. https://t.co/LHtWBnS0aw","Barack Obama","Washington, DC",FALSE,2015-12-04
2015-12-04 16:29:22,"BarackObama","The economy added 211,000 jobs in November—a record-breaking 69 consecutive months of private-sector job growth.","Barack Obama","Washington, DC",FALSE,2015-12-04
2015-12-02 19:25:57,"BarackObama","Countries all over the world are standing #UnitedOnClimate—join the conversation to be part of this historic moment: https://t.co/mhF9PsXw28","Barack Obama","Washington, DC",FALSE,2015-12-02
2015-12-02 16:36:30,"BarackObama","This is a huge step forward. #UnitedOnClimate https://t.co/E8jvEr1PXH","Barack Obama","Washington, DC",FALSE,2015-12-02
2015-12-01 23:26:57,"BarackObama","Sixty years later, we remember the heroism of Rosa Parks and recommit to the fight for justice and equality. https://t.co/NOHa4cv8DL","Barack Obama","Washington, DC",FALSE,2015-12-01
2015-12-01 18:57:09,"BarackObama","Climate change deniers are trying to undermine America's commitment to #ActOnClimate. Read more: https://t.co/uzZgDXrny1","Barack Obama","Washington, DC",FALSE,2015-12-01
2015-12-01 17:40:33,"BarackObama","Be a part of this historic moment in the fight against climate change—join the #UnitedOnClimate conversation: https://t.co/47SrSAKaqp #COP21","Barack Obama","Washington, DC",FALSE,2015-12-01
2015-11-30 23:13:58,"BarackObama","Stand up for global action on climate change—add your name: https://t.co/MuaIyh1rkj #ActOnClimate https://t.co/OOG1VviHCw","Barack Obama","Washington, DC",FALSE,2015-11-30
2015-11-30 21:26:14,"BarackObama","The global talks on climate change have begun. Join the conversation: https://t.co/HSeUsM9avN #UnitedOnClimate","Barack Obama","Washington, DC",FALSE,2015-11-30
2015-11-30 20:08:58,"BarackObama","Watch President Obama discuss how to build a framework for progress on the global effort to tackle climate change. https://t.co/9zQWCyqYzA","Barack Obama","Washington, DC",FALSE,2015-11-30
2015-11-30 18:19:54,"BarackObama","Read why the international climate talks in Paris are so important: https://t.co/FlasnjEIdK #COP21","Barack Obama","Washington, DC",FALSE,2015-11-30
2015-11-28 22:17:24,"BarackObama","Enrolling is easy. Check out your options and #GetCovered today: https://t.co/RjOJ3Sd7KH","Barack Obama","Washington, DC",FALSE,2015-11-28
2015-11-27 20:26:38,"BarackObama","Show your support for American leadership in the international effort to #ActOnClimate: https://t.co/mhuMkdtvMZ","Barack Obama","Washington, DC",FALSE,2015-11-27
2015-11-27 18:26:09,"BarackObama","The Clean Power Plan is one of the biggest step America's ever taken to tackle climate change. https://t.co/UOvVIhJ7pp","Barack Obama","Washington, DC",FALSE,2015-11-27
2015-11-27 16:22:51,"BarackObama","Post Thanksgiving to-do list:

Sleep: ✓
Dishes. So many dishes: ✓
#GetCovered: https://t.co/VnZnTvGRJv","Barack Obama","Washington, DC",FALSE,2015-11-27
2015-11-26 17:49:28,"BarackObama","Be thankful today—and don't forget to give back. #HappyThanksgiving https://t.co/0rXUAY3aP1","Barack Obama","Washington, DC",FALSE,2015-11-26
2015-11-26 16:48:54,"BarackObama","""No matter our circumstances, all of us have something to be grateful for."" —President Obama https://t.co/sCowTWI2Lu #HappyThanksgiving","Barack Obama","Washington, DC",FALSE,2015-11-26
2015-11-25 19:47:37,"BarackObama","LIVE: President Obama is celebrating the 68th anniversary of the National Thanksgiving Turkey presentation. https://t.co/SwdlqcbFaq","Barack Obama","Washington, DC",FALSE,2015-11-25
2015-11-25 18:30:09,"BarackObama","Read from @GinaEPA on how the United States is leading the international effort to #ActOnClimate: https://t.co/1H3ZafxtPo","Barack Obama","Washington, DC",FALSE,2015-11-25
2015-11-24 19:17:58,"BarackObama","Read how @OFA volunteers in Tennessee are making sure that everyone has access to quality, affordable health care: https://t.co/Sc7zDxRI9Y","Barack Obama","Washington, DC",FALSE,2015-11-24
2015-11-24 16:31:29,"BarackObama","Before you start cooking this week, make sure you're covered: https://t.co/2Rl8967kZX #GetCovered","Barack Obama","Washington, DC",FALSE,2015-11-24
2015-11-23 21:17:20,"BarackObama","No more excuses. It's time to #ActOnClimate: https://t.co/XzQX5J0jpA https://t.co/9mtCVvNiLx","Barack Obama","Washington, DC",FALSE,2015-11-23
2015-11-23 19:04:56,"BarackObama","Say you're ready for strong global efforts to #ActOnClimate—don't let climate change deniers prevent progress: https://t.co/jiAVOprWZQ","Barack Obama","Washington, DC",FALSE,2015-11-23
2015-11-23 17:41:52,"BarackObama","Get a close look inside the first-ever @OFA Organizing Director Summit: https://t.co/egN28SJ0SP","Barack Obama","Washington, DC",FALSE,2015-11-23
2015-11-21 00:35:06,"BarackObama","One year ago the President took common-sense #ImmigrationAction—but a long-term fix still hasn't come from Congress. https://t.co/gimZAaLhdw","Barack Obama","Washington, DC",FALSE,2015-11-21
2015-11-20 22:16:11,"BarackObama","Happy birthday @VP. Here's to a great year. https://t.co/wTNdi5EPr3","Barack Obama","Washington, DC",FALSE,2015-11-20
2015-11-20 21:09:39,"BarackObama","Getting help is easy. Check out your options and #GetCovered today: https://t.co/GdJw8C26Yn https://t.co/OAh3bawk7w","Barack Obama","Washington, DC",FALSE,2015-11-20
2015-11-20 19:34:52,"BarackObama","Record-breaking temperatures in October keeps 2015 on track to be the hottest year ever: https://t.co/CplyuXjhDU","Barack Obama","Washington, DC",FALSE,2015-11-20
2015-11-20 17:57:44,"BarackObama","Don't let climate change deniers stand in the way of global progress on climate action: https://t.co/C23ubl5JhK #ActOnClimate","Barack Obama","Washington, DC",FALSE,2015-11-20
2015-11-20 16:34:27,"BarackObama","It's crucial to #ActOnClimate—and this is just one way the Clean Power Plan is a step forward. https://t.co/ocxLx79spL","Barack Obama","Washington, DC",FALSE,2015-11-20
2015-11-19 22:47:03,"BarackObama","""Progress isn’t guaranteed. It’s not inevitable. It’s something that has to be fought for."" —President Obama https://t.co/GhtHOQNU5u","Barack Obama","Washington, DC",FALSE,2015-11-19
2015-11-19 20:36:53,"BarackObama","The international community is committed to #ActOnClimate—show your support for global action: https://t.co/yQZV3HB089","Barack Obama","Washington, DC",FALSE,2015-11-19
2015-11-19 17:47:05,"BarackObama","Progress on tackling climate change is happening—and we can't go back. #ActOnClimate https://t.co/w2MLu1V6Xc","Barack Obama","Washington, DC",FALSE,2015-11-19
2015-11-19 16:09:18,"BarackObama","The health care marketplace is open—for a limited time. Now's your chance to #GetCovered. https://t.co/Zubt5iIRTh https://t.co/qA7KHMR140","Barack Obama","Washington, DC",FALSE,2015-11-19
2015-11-18 23:56:54,"BarackObama","Say you're ready for big progress in the global effort to #ActOnClimate—add your name: https://t.co/bPePodECOq","Barack Obama","Washington, DC",FALSE,2015-11-18
2015-11-18 20:59:17,"BarackObama","Hundreds of hardworking @OFA organizers came together at the #OFAFallSummit to drive their work forward—take a look: https://t.co/652zNmfJWy","Barack Obama","Washington, DC",FALSE,2015-11-18
2015-11-18 20:01:51,"BarackObama","Don't let climate change deniers derail progress in the global effort to #ActOnClimate: https://t.co/mPmFhSUoSL https://t.co/AG1XQ3AyFR","Barack Obama","Washington, DC",FALSE,2015-11-18
2015-11-18 16:19:08,"BarackObama","In two weeks, nations across the globe are gathering to #ActOnClimate—this is a big deal. https://t.co/HL6q3Aj507","Barack Obama","Washington, DC",FALSE,2015-11-18
2015-11-17 19:06:20,"BarackObama","The U.S. has already tripled wind and solar energy since 2008. The Clean Power Plan will continue that progress. https://t.co/nRx3sbbKny","Barack Obama","Washington, DC",FALSE,2015-11-17
2015-11-17 16:30:37,"BarackObama","The Clean Power Plan is a vital step to #ActOnClimate and improve public health. https://t.co/kJhg6FnU0M","Barack Obama","Washington, DC",FALSE,2015-11-17
2015-11-16 23:25:34,"BarackObama","Get the facts on important issues like climate change—join the OFA Truth Team: https://t.co/ounOuTRFqA","Barack Obama","Washington, DC",FALSE,2015-11-16
2015-11-16 20:36:30,"BarackObama","You might be able to get an even better health care plan. Shop around today: https://t.co/UrTpGIT1JG #GetCovered https://t.co/0xlc4VccVF","Barack Obama","Washington, DC",FALSE,2015-11-16
2015-11-13 19:14:48,"BarackObama","The security of affordable health care might make you dance: https://t.co/NfKd2cDWXk #GetCovered https://t.co/CCKa5DiSPH","Barack Obama","Washington, DC",FALSE,2015-11-13
2015-11-13 17:32:06,"BarackObama","Man-made climate change is having a big effect on global temperatures. Read more: https://t.co/ps452iI0tN #ActOnClimate","Barack Obama","Washington, DC",FALSE,2015-11-13
2015-11-12 22:45:38,"BarackObama","The fight for common-sense #ImmigrationAction isn't over. Read more: https://t.co/L8PbZAgdlL","Barack Obama","Washington, DC",FALSE,2015-11-12
2015-11-12 18:49:06,"BarackObama","Read from veteran and former Federal Chief Sustainability Officer Jon Powers on why it's time to #ActOnClimate: https://t.co/ykAO114cl7","Barack Obama","Washington, DC",FALSE,2015-11-12
2015-11-12 16:38:51,"BarackObama","Be covered this winter—check out your options now: https://t.co/On5W1AuV89 #GetCovered https://t.co/KZNnjQaIJE","Barack Obama","Washington, DC",FALSE,2015-11-12
2015-11-11 18:26:33,"BarackObama","""On this day and every day, we thank you."" —President Obama #VeteransDay https://t.co/nRcBslDrdh","Barack Obama","Washington, DC",FALSE,2015-11-11
2015-11-11 16:40:48,"BarackObama","LIVE: President Obama is honoring veterans at Arlington National Cemetery. https://t.co/IZgdqYxNZ2 #VeteransDay","Barack Obama","Washington, DC",FALSE,2015-11-11
2015-11-10 23:31:25,"BarackObama","ICYMI: The unemployment rate is now at a seven-year low. https://t.co/GV0CqiLHBP","Barack Obama","Washington, DC",FALSE,2015-11-10
2015-11-10 22:07:06,"BarackObama","Make sure to check this off your list: https://t.co/obg1pKy0Bk #GetCovered https://t.co/I17bWv0MDt","Barack Obama","Washington, DC",FALSE,2015-11-10
2015-11-10 20:16:54,"BarackObama","President Obama explains why the #TPP is good for American workers and the middle class: https://t.co/haLcmPkkIg","Barack Obama","Washington, DC",FALSE,2015-11-10
2015-11-09 22:09:46,"BarackObama","""I'm going to keep on going as long as you'll have me."" —President Obama to @OFA volunteers #OFAFallSummit","Barack Obama","Washington, DC",FALSE,2015-11-09
2015-11-09 22:08:40,"BarackObama","""I need you to stay involved. I need you to stay active."" —President Obama #OFAFallSummit","Barack Obama","Washington, DC",FALSE,2015-11-09
2015-11-09 22:07:34,"BarackObama","""I may only hold this office for the next 14 months, but I'm not going anywhere."" —President Obama #OFAFallSummit","Barack Obama","Washington, DC",FALSE,2015-11-09
2015-11-09 22:06:32,"BarackObama","""When the cynics tell us we can't change this country for the better, we know they're wrong. We've got proof."" —President Obama","Barack Obama","Washington, DC",FALSE,2015-11-09
2015-11-09 22:05:28,"BarackObama","""We've still got our work cut out for us to fix the broken immigration system."" —President Obama #OFAFallSummit","Barack Obama","Washington, DC",FALSE,2015-11-09
2015-11-09 22:04:26,"BarackObama","""Your organizing skills are more important than ever.""—President Obama #OFAFallSummit","Barack Obama","Washington, DC",FALSE,2015-11-09
2015-11-09 22:03:05,"BarackObama","""You know we've got more work to do. You wouldn't be here if you didn't think we have more work to do.""—President Obama #OFAFallSummit","Barack Obama","Washington, DC",FALSE,2015-11-09
2015-11-09 22:02:16,"BarackObama","""Even as our economy is growing, America's cut our carbon pollution more than any other advanced nation on Earth."" —President Obama","Barack Obama","Washington, DC",FALSE,2015-11-09
2015-11-09 22:01:25,"BarackObama","""We've covered 17.6 million Americans so far, and in the process the deficit's been cut by two-thirds."" —President Obama #OFAFallSummit","Barack Obama","Washington, DC",FALSE,2015-11-09
2015-11-09 22:00:14,"BarackObama","""We've seen the longest streak of private-sector job creation on record—that happened because of you."" —President Obama #OFAFallSummit","Barack Obama","Washington, DC",FALSE,2015-11-09
2015-11-09 21:59:12,"BarackObama","""You figure out what's important in your communities and you organize around it.""—President Obama at the #OFAFallSummit","Barack Obama","Washington, DC",FALSE,2015-11-09
2015-11-09 21:57:35,"BarackObama","""You be the change you want to come about.""—President Obama #OFAFallSummit","Barack Obama","Washington, DC",FALSE,2015-11-09
2015-11-09 21:56:37,"BarackObama","""Together, we created a movement for change that couldn't be denied.""—President Obama #OFAFallSummit","Barack Obama","Washington, DC",FALSE,2015-11-09
2015-11-09 21:54:08,"BarackObama","""It's always good to be with OFA. It's a little bit like coming home.""—President Obama #OFAFallSummit","Barack Obama","Washington, DC",FALSE,2015-11-09
2015-11-09 21:51:13,"BarackObama","LIVE: President Obama is speaking to @OFA volunteers at the #OFAFallSummit. https://t.co/Ao84Izvixv","Barack Obama","Washington, DC",FALSE,2015-11-09
2015-11-09 21:40:23,"BarackObama","""It was never about yes he can—it was about yes we can."" —@Simas44 #OFAFallSummit","Barack Obama","Washington, DC",FALSE,2015-11-09
2015-11-07 18:29:27,"BarackObama","""For the first time, more than 90% of Americans are covered."" —President Obama https://t.co/oEk3RYamsm #GetCovered","Barack Obama","Washington, DC",FALSE,2015-11-07
2015-11-07 16:58:54,"BarackObama","In the weekly address, President Obama discusses why it's so important to #GetCovered: https://t.co/tx19WZPV6u","Barack Obama","Washington, DC",FALSE,2015-11-07
2015-11-06 20:47:06,"BarackObama","Retweet if you support American leadership on climate change. #ActOnClimate https://t.co/nzUDGeuE7v","Barack Obama","Washington, DC",FALSE,2015-11-06
2015-11-06 17:53:43,"BarackObama","The President just rejected #KeystoneXL. Add your name to support strong action on climate change: https://t.co/UQ4n60s4fw #ActOnClimate","Barack Obama","Washington, DC",FALSE,2015-11-06
2015-11-06 17:12:19,"BarackObama","""If we want to prevent the worst effects of climate change before it's too late, the time to act is now."" —President Obama #ActOnClimate","Barack Obama","Washington, DC",FALSE,2015-11-06
2015-11-06 17:09:25,"BarackObama","""Shipping crude oil into our country would not increase America's energy security."" —President Obama #KeystoneXL","Barack Obama","Washington, DC",FALSE,2015-11-06
2015-11-06 17:08:13,"BarackObama","""Today, in 41 states, drivers can find at least one gas station selling gas for less than $2 a gallon."" —President Obama #KeystoneXL","Barack Obama","Washington, DC",FALSE,2015-11-06
2015-11-06 17:07:00,"BarackObama","""In fact, gas prices have already been falling, steadily."" —President Obama on rejecting the #KeystoneXL","Barack Obama","Washington, DC",FALSE,2015-11-06
2015-11-06 17:05:44,"BarackObama","""The pipeline would not lower gas prices for American consumers."" —President Obama on rejecting the #KeystoneXL","Barack Obama","Washington, DC",FALSE,2015-11-06
2015-11-06 17:04:02,"BarackObama","""If Congress is serious about wanting to create jobs, this was not the way to do it."" —President Obama on rejecting the #KeystoneXL","Barack Obama","Washington, DC",FALSE,2015-11-06
2015-11-06 17:02:47,"BarackObama","""The pipeline would not make a meaningful, long-term contribution to our economy."" —President Obama on rejecting the #KeystoneXL","Barack Obama","Washington, DC",FALSE,2015-11-06
2015-11-06 16:59:52,"BarackObama","BREAKING: President Obama just took another huge step to #ActOnClimate by rejecting the #KeystoneXL pipeline.","Barack Obama","Washington, DC",FALSE,2015-11-06
2015-11-06 16:58:43,"BarackObama","LIVE: President Obama is delivering a statement. https://t.co/BprUPFQ9DJ","Barack Obama","Washington, DC",FALSE,2015-11-06
2015-11-06 15:52:47,"BarackObama","The economy added 271,000 jobs in October—a record-breaking 68 consecutive months of private-sector job growth.","Barack Obama","Washington, DC",FALSE,2015-11-06
2015-11-05 22:16:32,"BarackObama","The #TPP eliminates 18,000 taxes that other countries put on American goods. https://t.co/VMPIrGn2Mf #LeadOnTrade","Barack Obama","Washington, DC",FALSE,2015-11-05
2015-11-05 20:53:16,"BarackObama","More American-made exports means more higher-paying jobs at home: https://t.co/FNGnIEzgUx #TPP https://t.co/vIKb91bB02","Barack Obama","Washington, DC",FALSE,2015-11-05
2015-11-05 19:36:40,"BarackObama","""When we have a level playing field, Americans out-compete anyone in the world."" —President Obama https://t.co/xShwzu6OQF #LeadOnTrade","Barack Obama","Washington, DC",FALSE,2015-11-05
2015-11-05 14:47:54,"BarackObama","Negotiations on the #TPP are complete, and the full text is now available online. Find out more: https://t.co/A6WiTdMOXp #LeadOnTrade","Barack Obama","Washington, DC",FALSE,2015-11-05
2015-11-04 22:10:37,"BarackObama","More than two dozen states and cities are fighting to #ActOnClimate by defending the Clean Power Plan: https://t.co/0k5rMve0WP","Barack Obama","Washington, DC",FALSE,2015-11-04
2015-11-04 18:19:41,"BarackObama","Finding a plan that fits your needs is easy. Check out your options and #GetCovered: https://t.co/1McmRF5opi https://t.co/xX0cVzJgxb","Barack Obama","Washington, DC",FALSE,2015-11-04
2015-11-04 17:15:15,"BarackObama","A vocal minority could still derail the bipartisan budget deal—don't let that happen. Show your support: https://t.co/ze6XlKvLWa","Barack Obama","Washington, DC",FALSE,2015-11-04
2015-11-03 22:38:08,"BarackObama","Get an update on issues that matter, from gun violence prevention to health care enrollment: https://t.co/Nyp6KzliFv","Barack Obama","Washington, DC",FALSE,2015-11-03
2015-11-03 16:56:40,"BarackObama","The marketplace is open again—shop around and find a plan that works for you: https://t.co/HeXYqOqu2g #GetCovered https://t.co/g8MCjKtsEj","Barack Obama","Washington, DC",FALSE,2015-11-03
2015-11-02 23:17:26,"BarackObama","Working hard in America shouldn't mean choosing between a paycheck and a sick kid at home. #LeadOnLeave https://t.co/Y4risUgFzH","Barack Obama","Washington, DC",FALSE,2015-11-02
2015-11-02 21:16:04,"BarackObama","LIVE: President Obama is speaking about the re-entry process of formerly incarcerated individuals. https://t.co/2RfSaJJ0hx","Barack Obama","Washington, DC",FALSE,2015-11-02
2015-11-02 20:30:01,"BarackObama","Tune in at 4:20 p.m. ET to watch President Obama speak on rehabilitation and reintegration: https://t.co/X1CmRvumbO #CriminalJusticeReform","Barack Obama","Washington, DC",FALSE,2015-11-02
2015-11-02 18:42:35,"BarackObama","Here's what happened when 35 passionate student organizers came together to learn how to improve their impact: https://t.co/3wRfGGGMQE","Barack Obama","Washington, DC",FALSE,2015-11-02
2015-11-02 16:48:39,"BarackObama","Under #Obamacare, the uninsured rate in the United States is at the lowest level on record. https://t.co/JclMvADTnN","Barack Obama","Washington, DC",FALSE,2015-11-02
2015-11-01 21:56:28,"BarackObama","Nearly 8 in 10 uninsured Americans may be eligible for financial help. Check out your options: https://t.co/mJtVbt1ba5 #GetReadyGetCovered","Barack Obama","Washington, DC",FALSE,2015-11-01
2015-11-01 21:04:20,"BarackObama","Open enrollment is back: https://t.co/DCGSKXPVzi #GetReadyGetCovered https://t.co/zACudz9e7c","Barack Obama","Washington, DC",FALSE,2015-11-01
2015-11-01 20:04:19,"BarackObama","Post Halloween checklist:

Coffee: ✓
Brunch: ✓
Health insurance: https://t.co/vD8uoA1Qis
#GetReadyGetCovered","Barack Obama","Washington, DC",FALSE,2015-11-01
2015-11-01 18:44:04,"BarackObama","The health care marketplace is open again. Check out your options now: https://t.co/osU8GUFSIu #GetCovered","Barack Obama","Washington, DC",FALSE,2015-11-01
2015-11-01 17:19:02,"BarackObama","Don't miss your chance to #GetCovered: https://t.co/pOS2uGg8f9 https://t.co/J24jqQZ2qm","Barack Obama","Washington, DC",FALSE,2015-11-01
2015-10-31 23:01:31,"BarackObama","Trick-or-treat? #HappyHalloween https://t.co/0T8yc2vYyk","Barack Obama","Washington, DC",FALSE,2015-10-31
2015-10-31 21:56:27,"BarackObama","Make sure you #GetCovered tomorrow—before you eat too much Halloween candy. https://t.co/h5gKMcxpS4","Barack Obama","Washington, DC",FALSE,2015-10-31
2015-10-31 18:27:27,"BarackObama","""Every year, we spend $80 billion in taxpayer dollars to keep people incarcerated."" —President Obama https://t.co/uQZOaQtJUM","Barack Obama","Washington, DC",FALSE,2015-10-31
2015-10-31 16:45:31,"BarackObama","In the weekly address, President Obama calls for meaningful criminal justice reform: https://t.co/uQZOaQtJUM","Barack Obama","Washington, DC",FALSE,2015-10-31
2015-10-30 22:42:56,"BarackObama","Don't miss it. #GetCovered https://t.co/gMIOgP4ukJ","Barack Obama","Washington, DC",FALSE,2015-10-30
2015-10-30 21:23:29,"BarackObama","Watch as President Obama and @FLOTUS welcome children to trick-or-treat at the White House: https://t.co/SXmz119b8h https://t.co/EgX7iptsd3","Barack Obama","Washington, DC",FALSE,2015-10-30
2015-10-30 19:40:38,"BarackObama","Passionate student organizers came together at @OFA's Campus Organizing Summit. Find out more: https://t.co/OZN4MovTxo","Barack Obama","Washington, DC",FALSE,2015-10-30
2015-10-30 17:37:20,"BarackObama","DYK: Under #Obamacare, millions of young adults are able to remain on their parents' plans until they turn 26. https://t.co/KrkFcb9KsH","Barack Obama","Washington, DC",FALSE,2015-10-30
2015-10-30 16:26:43,"BarackObama","""I applaud the Democrats and Republicans who came together this morning to pass a responsible, long-term budget agreement."" —President Obama","Barack Obama","Washington, DC",FALSE,2015-10-30
2015-10-29 21:45:32,"BarackObama","Spread the word: There are nearly 10.5 million uninsured Americans who may be eligible to #GetCovered in 2016. https://t.co/2X9XiLsgVR","Barack Obama","Washington, DC",FALSE,2015-10-29
2015-10-29 19:49:48,"BarackObama","Read @ShaunOMB's op-ed on how science and data are helping the U.S. focus on the long-term costs of climate change: https://t.co/324sszQ7BZ","Barack Obama","Washington, DC",FALSE,2015-10-29
